{
  "trigger": "bn240403498",
  "canonical_det": "n0",
  "reference_det": "n0",
  "grid_type": "gbm_fine",
  "blocks_file": "/usr/local/disk1/SinglePulses/results/mine/blocks/bb_blocks_spectral_bn240403498.ecsv",
  "fit_dets": [
    "n0",
    "n1",
    "n2",
    "n5",
    "b0"
  ],
  "n_blocks": 15,
  "NAI_RANGES": [
    "8.1-900"
  ],
  "NAI_EXCLUDE": [
    "30-40"
  ],
  "BGO_RANGES": [
    "200-38000"
  ],
  "LLE_RANGES": [
    "20000-100000"
  ],
  "RANGES_CONVENTION": "Chand2020_ApJ903_9",
  "models": [
    "Band",
    "CPL",
    "SBPL",
    "DSBPL",
    "Band+BB",
    "CPL+BB",
    "SBPLfree",
    "DSBPLfree",
    "Band+PL",
    "Band+CPL",
    "CPL+PL",
    "CPL+CPL",
    "BandR+CPL",
    "BandxCut",
    "SBPLxCut",
    "SBPL+PL",
    "SBPL+CPL",
    "Band+BB+PL",
    "Band+BB+CPL",
    "CPL+BB+PL",
    "CPL+BB+CPL",
    "SBPL+BB",
    "SBPL+BB+PL",
    "SBPL+BB+CPL"
  ],
  "bin_starts": [
    22.26930993795395,
    23.61096101999283,
    24.713845014572144,
    25.20631903409958,
    26.22629290819168,
    27.04307496547699,
    27.297322928905487,
    27.858357906341553,
    28.307014882564545,
    28.8154519200325,
    29.39763993024826,
    30.690744996070862,
    32.47071295976639,
    35.844761967659,
    39.68244796991348
  ],
  "bin_stops": [
    23.61096101999283,
    24.713845014572144,
    25.20631903409958,
    26.22629290819168,
    27.04307496547699,
    27.297322928905487,
    27.858357906341553,
    28.307014882564545,
    28.8154519200325,
    29.39763993024826,
    30.690744996070862,
    32.47071295976639,
    35.844761967659,
    39.68244796991348,
    43.97161793708801
  ]
}